{"artifacts":[{"byteLength":62529,"relativePath":"scripts/verification/architecture.ts","sha256":"8c90b90d55e92dd0a8afbf53741992de2bcddb6dbabb9385b77ba0510010041b"},{"byteLength":30191,"relativePath":"scripts/verification/command-effect-inventory.ts","sha256":"bab2a7216d8ebf5915fd39dd0fcbb4f850254bd3b0af844c674c3e983e0e74a7"},{"byteLength":13306,"relativePath":"scripts/verification/effect-surface.ts","sha256":"7164c1c8847004b7277ac51b3cce636ed0e59eed38904fb2d73526747f4d12fd"},{"byteLength":68251,"relativePath":"scripts/verification/governed-source.ts","sha256":"25fccbdac9f14b01f6890e3865531cbedc493df0af220275d2d52089a5d1b3e6"},{"byteLength":40514,"relativePath":"scripts/verification/immutable-receipt.ts","sha256":"31b9d6d3bd282159119b2b393dbe049e4100d6f9c94a6619d125465c1464b4a6"},{"byteLength":14293,"relativePath":"scripts/verification/safe-repository-reader.ts","sha256":"1493cf1a127b05e4b5c2d54c6b467caadc8deeef7a3f75128e4867f00a6011c6"},{"byteLength":10856,"relativePath":"scripts/verification/static-source.ts","sha256":"30f9741d7a15ea112a4c1be668a508149da2cf5db6ef5bb7340b58ff09c12d10"},{"byteLength":149255,"relativePath":"src/architecture-manifest.ts","sha256":"26a2d9d6f83e70d7453355644cd3f610267a512aea80c9daa937a869116d043b"},{"byteLength":2056,"relativePath":"src/classification-catalog.ts","sha256":"d83b25cfaff731733b5e0c42b809edd7a2f309a9f9c265851a987de17e989d03"},{"byteLength":794,"relativePath":"src/errors.ts","sha256":"49972c62cec43bfa94f29e929551d32771f0c993496f9129e7340d0a20dbbe32"},{"byteLength":2824,"relativePath":"src/integrity.ts","sha256":"1f0bae37ddf156237a97a846ea3dcb238af6612f3d960ccac5fe9432050377e4"},{"byteLength":1374,"relativePath":"src/json-integrity.ts","sha256":"2754351cae410d14715fb7de5ccb5d0e43aeba210dc2868ed2a47fc10d3e77b3"},{"byteLength":846,"relativePath":"src/linux-path.ts","sha256":"cf4246992e22f81e92a0e7cec962bc429d52bf669102630dd3694b56cfac3997"},{"byteLength":401,"relativePath":"src/ordered.ts","sha256":"dfd962768d4d7dc9487036903294e373e32e165c07c409b16bb5c0fc2b7f0efb"},{"byteLength":1225,"relativePath":"src/path-boundary.ts","sha256":"3b1a25d3cc937ec036cfe0b9a8cb872b4f4110920fa0474d49f62fe434e4fd03"},{"byteLength":46445,"relativePath":"src/requirements.ts","sha256":"71b4bb9b1bec943cdc4d5ddd419e542c00ca9c38bd25b97d308a59c48c92ffd9"},{"byteLength":83237,"relativePath":"src/root-policy.ts","sha256":"467000004c7a2734f80122f912cc9a8983425715a03d1516168dfda836b839cb"},{"byteLength":715,"relativePath":"src/runtime-capabilities.ts","sha256":"c163513a28fabd6d0afc231e78028af8d24fadfdb5a4b1fb167d6e65297e8876"},{"byteLength":2543,"relativePath":"src/secret-signals.ts","sha256":"c869e2fa9273a88f66f63c40a45be76de9855c1d78a6047a77f7ee76fbf8d3fc"},{"byteLength":3839,"relativePath":"verification/benchmarks/coordination/migration-write-authority/author-receipt.mjs","sha256":"e12aef8d38d5cae018602a527d37597b87bedb8f08bb3bc8a10b5894babf46a8"},{"byteLength":1186,"relativePath":"verification/benchmarks/coordination/migration-write-authority/author-trust-base.d.mts","sha256":"ca8918c95c0fccb0d5a9ad2269f880682656349528476bb266143890fac58f43"},{"byteLength":3788,"relativePath":"verification/benchmarks/coordination/migration-write-authority/author-trust-base.mjs","sha256":"cfdce700af483e3f00fb15583532a8e9caf9f4137cfbc5f824beead56ddfbed5"},{"byteLength":2339,"relativePath":"verification/benchmarks/coordination/migration-write-authority/build-author-receipt.mjs","sha256":"bc7a3cb70db66232e6286a665eefd63307abf854be3b08fd5eac5d003cd1862c"},{"byteLength":10217,"relativePath":"verification/benchmarks/coordination/migration-write-authority/build-protocol-fixtures.mjs","sha256":"ba921a39cd0ec095498dbac6dfbe6f46dd6c99ead471201f4066ca8ed7eca9b4"},{"byteLength":35365,"relativePath":"verification/benchmarks/coordination/migration-write-authority/fixtures/authority-protocol-fixtures.v2.json","sha256":"dfda9ac810ede7d8911ed4c7d7bee2ef73eeb2d487765d2fdc94885c2b6b306a"},{"byteLength":4725,"relativePath":"verification/benchmarks/coordination/migration-write-authority/qualification-contract.v2.json","sha256":"128c6b31793ef3606c3ecc975b6763fcd303b64ed29dc9959c5962058a21cbd5"},{"byteLength":9683,"relativePath":"verification/benchmarks/coordination/migration-write-authority/repository-facts-contract.mjs","sha256":"2112de4a6e8ede538b8b3f251db67d013060b83181a692a50e7b4da05f9fe288"},{"byteLength":17119,"relativePath":"verification/benchmarks/coordination/migration-write-authority/repository-facts.mjs","sha256":"b5ff5ef2211b91501277a199a5ed82675277b4c40256c43de1b7d1573f99f6bb"},{"byteLength":6133,"relativePath":"verification/benchmarks/coordination/migration-write-authority/schemas/author-receipt.v2.schema.json","sha256":"3b5c361477fc6112ecf39082e04d88069838d4a82e7b83b0c3747b309ae7e439"},{"byteLength":23567,"relativePath":"verification/benchmarks/coordination/migration-write-authority/schemas/authority-protocol.schema.json","sha256":"822c842f95ce440203010c01132fe427e46673aae23e803f71625bef1c4c0366"},{"byteLength":7910,"relativePath":"verification/benchmarks/coordination/migration-write-authority/schemas/qualification-contract.schema.json","sha256":"39e2ddf5a11141bfc91110e5295cfc04d3540917e7eef744f309ba8a8c748da5"},{"byteLength":13178,"relativePath":"verification/benchmarks/coordination/migration-write-authority/schemas/repository-facts-run.schema.json","sha256":"99f318cd277059f4be525f2a71fe0535f03407a97f2c7d5f3259620ac0a407a3"},{"byteLength":24656,"relativePath":"verification/benchmarks/coordination/migration-write-authority/test-contracts.mjs","sha256":"4b6db644b9954decd2ebe2d96eb95d8e34d43b014f3875516ac94a9906c12913"},{"byteLength":8566,"relativePath":"verification/benchmarks/coordination/migration-write-authority/test-repository-facts.mjs","sha256":"4ee00b6807f058f2458dc8f21fadfc19676eb875835bc7bc7b3947d34751bfb9"},{"byteLength":17546,"relativePath":"verification/benchmarks/coordination/migration-write-authority/validate-contracts.mjs","sha256":"233dba471d481a62551568afe127ff9ea4fb1bbccc68477eee0cae909f60928a"},{"byteLength":8488,"relativePath":"verification/benchmarks/coordination/migration-write-authority/validate-repository-facts.mjs","sha256":"c3ecd14f605affa205b7de423810af194079da9c5ef58b0e1b2f1978b3b5f807"},{"byteLength":1450,"relativePath":"verification/benchmarks/shared/command-effect-contract.d.mts","sha256":"0dc7518df933908cba82f95756b3dcd6b0edc148f546ab702f12380914ec2768"},{"byteLength":3987,"relativePath":"verification/benchmarks/shared/command-effect-contract.mjs","sha256":"b65218259498489a9cae0fa6509d91c44c106ea1393d651fca619d3cae7d4afc"},{"byteLength":6813,"relativePath":"verification/benchmarks/shared/qualification-authority-audit.mjs","sha256":"3ee1118b88e6a0df80dac884ed8b8afb36460dcd978c7f96d1836d2679cefc19"},{"byteLength":1663,"relativePath":"verification/benchmarks/shared/qualification-authority-contract.d.mts","sha256":"e7737c97af73d3c6e51bcf63206237127914cfa3d08c5bf6f9be9a25df0d2941"},{"byteLength":8255,"relativePath":"verification/benchmarks/shared/qualification-authority-contract.mjs","sha256":"186270941fa403b0e43d4290ac4973a8013a0161f74dc96739fafeeaa55d783d"},{"byteLength":55835,"relativePath":"verification/benchmarks/shared/qualification-authority-inventory.mjs","sha256":"d73ae931ba8c88fead6e2062c80d2b8ff6ffdbef95f0df0528b9445b61ca227c"},{"byteLength":14103,"relativePath":"verification/benchmarks/shared/qualification-authority-inventory.schema.json","sha256":"8d17ad9028b57a81050ce9eb190f44507f4f15d212c7a8baf5ca36f0723097e4"},{"byteLength":594172,"relativePath":"verification/benchmarks/shared/qualification-authority-inventory.v5.json","sha256":"d46beef4ee18c9be41027d4dd434f6e18541c5781bd84f23a8dd275888e710f5"},{"byteLength":19516,"relativePath":"verification/benchmarks/shared/qualification-authority.mjs","sha256":"a307a02c31c6534993a83ed833b7da82fd0b4d473970e82ba9890f168d48d0d5"},{"byteLength":13405,"relativePath":"verification/benchmarks/shared/qualification-parser.mjs","sha256":"f30c4f88ebd3a8b1ab056ca45d8647e47b0f6c08cf46e4b200e000989b5334ee"},{"byteLength":35307,"relativePath":"verification/benchmarks/shared/test-qualification-authority.mjs","sha256":"327c990fb25eaa15c345422dca5d0e7d1fb595bdb20014bf4ea49f3c0adbdabc"}],"claims":{"coWeakeningPreventedByExternalReceiptHash":true,"independentAcceptance":false,"runtimeQualification":false,"serializedReceiptConfersAuthority":false},"schemaVersion":"migration-write-authority-author-receipt/v2","status":"author-snapshot-unadmitted-externally-pinned-hash-required","verifierTrustBase":{"environmentBindings":{"mode":"compiled-source-accesses","names":[]},"lease":{"leaseId":"migration-write-authority/verifier-trust-base","leaseIdentity":"c89eac2080d9a5dcd101cc59d073414cde2c76247fb391a7ee0075384b9d5e57","requiredUseCardinality":1},"node":{"byteLength":123655872,"execArgv":[],"originClass":"host-runtime-executable","portableIdentity":"ee29c0b2f423a5324078e3c562cf75bb53068502c5fea5116b9c7f4fb6979473","sha256":"41a74efb34cbde5c7632cdac0cf8bd1a14d0b8d73dc1e82755014d9a9ce70f5c","version":"v24.18.0"},"originClass":"portable-repository-qualification-trust-base","packageRootsDerivedInternally":true,"packages":[{"contentIdentity":"3671027c686636d1e0786abb29c84360ac77154931642d93cc84bb533a3277c7","declaredRuntimeDependencies":["fast-deep-equal","fast-uri","json-schema-traverse","require-from-string"],"files":[{"byteLength":496,"relativePath":".runkit_example.js","sha256":"e37e85bf1db5d53a6e4e38a9cac83db25208f28c09a2fa19e3971877c8a7b8cf"},{"byteLength":1090,"relativePath":"LICENSE","sha256":"a05350a88e318e4f5f2c2a1ff1e2e88daa4dd38e6e78b71cccae422bdc762cc3"},{"byteLength":13781,"relativePath":"README.md","sha256":"38d924524762b917dd9dd341ac28837df51a474bf198ac4c26ba69d8f59a27c3"},{"byteLength":1241,"relativePath":"dist/2019.d.ts","sha256":"1e2bbd6318653c49684963a59066e621a3a142ad23b5e809e430e73946aa4223"},{"byteLength":3188,"relativePath":"dist/2019.js","sha256":"4a1b1d479d0b946af0119f3a3960fcabfd964e1c20e87f7a9575f8f9e705d0c4"},{"byteLength":1639,"relativePath":"dist